<?xml version="1.0" encoding="UTF-8"?>
<!--Sample XML file generated by XMLSpy v2013 (http://www.altova.com)-->
<Document xsi:schemaLocation="http://www.six-interbank-clearing.com/de/camt.050.001.03.ch.01 camt.050.001.03.ch.01.xsd" xmlns="http://www.six-interbank-clearing.com/de/camt.050.001.03.ch.01" xmlns:xsi="http://www.w3.org/2001/XMLSchema-instance">
	<LqdtyCdtTrf>
		<MsgHdr>
			<MsgId>MSG-001</MsgId>
			<CreDtTm>2012-08-13T11:30:20</CreDtTm>
		</MsgHdr>
		<LqdtyCdtTrf>
			<LqdtyTrfId>
				<InstrId>+2012012500001</InstrId>
				<EndToEndId>NOTPROVIDED</EndToEndId>
			</LqdtyTrfId>
			<Cdtr>
				<FinInstnId>
					<ClrSysMmbId>
						<MmbId>001008</MmbId>
					</ClrSysMmbId>
				</FinInstnId>
			</Cdtr>
			<TrfdAmt>
				<AmtWthCcy Ccy="CHF">3342534064.00</AmtWthCcy>
			</TrfdAmt>
			<Dbtr>
				<FinInstnId>
					<ClrSysMmbId>
						<MmbId>002301</MmbId>
					</ClrSysMmbId>
				</FinInstnId>
			</Dbtr>
			<SttlmDt>2012-08-13</SttlmDt>
		</LqdtyCdtTrf>
	</LqdtyCdtTrf>
</Document>
